{
  "schema_version": 1,
  "catalog_kind": "current-capability-evidence",
  "frozen_commit": "a582776d1bd78ab88d972e32fbaece594eb43512",
  "source_graph": {
    "identity_path": "流程图/主程序可达调用关系/00_main可达函数身份表.json",
    "edge_path": "流程图/主程序可达调用关系/01_main可达项目调用边表.json",
    "knowledge_graph_path": "流程图/代码流程图/00_调用知识图谱.json",
    "embedded_code_commit": "3920a74638264f9f539d50f32f3c9fe5fb1982ab",
    "currentity_method": "逐文件核对 embedded_code_commit 到 frozen_commit 的 Git 差异为零；函数身份、调用边与流程图只读取 frozen_commit 已发布 Git 树，未使用工作区 WIP",
    "verified_unchanged_files": [
      "海中鱼巣/启动.程序入口.ixx",
      "海中鱼巣/启动.应用程序.ixx",
      "海中鱼巣/装配.普通应用.ixx",
      "海中鱼巣/领域/初始化.系统.ixx",
      "海中鱼巣/适配/审计.数据库启动.ixx",
      "海中鱼巣/启动.生产运行期.ixx",
      "海中鱼巣/领域/方法服务.h",
      "海中鱼巣/线程/自我线程.ixx",
      "海中鱼巣/领域/初始化.概念图.ixx",
      "海中鱼巣/核心/节点仓库.cpp",
      "海中鱼巣/领域/控制面板服务.h",
      "海中鱼巣/核心/关系仓库.cpp",
      "海中鱼巣/核心/会话.结构写入.ixx"
    ]
  },
  "selection_scope": {
    "root": "main-current-reachable",
    "included": [
      "公开启动与组合入口",
      "领域初始化入口",
      "线程与运行期宿主入口",
      "仓库只读入口",
      "结构写入会话入口",
      "控制面板只读材料入口"
    ],
    "excluded": [
      "构造函数和析构函数",
      "简单访问器和运算符",
      "lambda与纯内部辅助函数",
      "只在自检内部使用的辅助函数",
      "main不可达或当前调用身份未冻结的入口"
    ],
    "reuse_decision": "不在本目录裁决"
  },
  "entry_count": 12,
  "status_summary": {
    "已实现待验证": 9,
    "候选待复核": 3
  },
  "entries": [
    {
      "capability_id": "CAP-0001",
      "name": "启动模式准入与顶层路由",
      "domain": "程序入口",
      "purpose_summary": "解析命令行中的唯一启动模式、返回结构化拒绝，并把已准入模式路由到唯一顶层运行函数。",
      "implementation_status": "已实现待验证",
      "status_basis": "两个根函数均为main直接可达，源码与冻结调用图一致，且已有完成的单函数现状流程图；本轮未运行入口专项。",
      "provider_entries": [
        {
          "function_id": "F0002",
          "complete_signature": "海中鱼巣::启动选项解析结果 海中鱼巣::解析并验证启动选项(int 参数数量, char* const 参数组[]) noexcept",
          "file": "海中鱼巣/启动.程序入口.ixx",
          "definition_line": 12,
          "shortest_depth": 1,
          "chart": "流程图/代码流程图/L1/CF-L1-0001_解析并验证启动选项_现状流程图.md",
          "mapping": "流程图/代码流程图/L1/CF-L1-0001_解析并验证启动选项_逐行代码映射表.md"
        },
        {
          "function_id": "F0005",
          "complete_signature": "海中鱼巣::程序运行结果 海中鱼巣::运行海中鱼巣(const 海中鱼巣::启动选项& 选项)",
          "file": "海中鱼巣/启动.应用程序.ixx",
          "definition_line": 444,
          "shortest_depth": 1,
          "chart": "流程图/代码流程图/L1/CF-L1-0004_运行海中鱼巣_现状流程图.md",
          "mapping": "流程图/代码流程图/L1/CF-L1-0004_运行海中鱼巣_逐行代码映射表.md"
        }
      ],
      "inputs": [
        "命令行参数数量与参数指针组",
        "已形成的启动选项"
      ],
      "preconditions": [
        "参数数量不小于1",
        "参数数组及各参数指针非空",
        "最多选择一个已登记模式",
        "性能或D455模式需要对应构建能力"
      ],
      "outputs": [
        "启动选项解析结果",
        "所选模式的程序运行结果"
      ],
      "state_reads": [
        "编译期开关",
        "启动选项中的强类型模式"
      ],
      "state_writes": [],
      "side_effects": [
        "路由函数调用所选顶层模式；具体副作用由被调模式承担"
      ],
      "transaction_contract": "本能力自身不取得业务结构事务。",
      "logic_results": [
        "未知参数",
        "重复参数",
        "模式组合冲突",
        "构建能力未启用",
        "已接受"
      ],
      "internal_error_boundaries": [
        "已准入模式枚举未被路由分支覆盖时返回内部不一致"
      ],
      "evidence": [
        {
          "kind": "源码",
          "path": "海中鱼巣/启动.程序入口.ixx",
          "locator": "12-81",
          "status": "冻结提交存在"
        },
        {
          "kind": "源码",
          "path": "海中鱼巣/启动.应用程序.ixx",
          "locator": "444-462",
          "status": "冻结提交存在"
        },
        {
          "kind": "现状流程图",
          "path": "流程图/代码流程图/L1/CF-L1-0001_解析并验证启动选项_现状流程图.md",
          "locator": "F0002",
          "status": "已完成静态制图"
        },
        {
          "kind": "正式规范",
          "path": "规范/8120_子规范_程序入口启动模式与运行宿主边界_20260726.md",
          "locator": "第2-4节",
          "status": "边界依据；不证明运行验证"
        },
        {
          "kind": "自检入口",
          "path": "海中鱼巣/启动.应用程序.ixx",
          "locator": "F0032 运行入口端口合同自检",
          "status": "入口存在；本轮未运行"
        }
      ],
      "reuse_boundary": "只能复用已登记模式及其结构化结果合同；不得借该入口塞入领域实现、自检正文或新的隐式模式。",
      "known_gaps": [
        "本轮没有运行命令行矩阵和退出码验证",
        "各模式内部能力完成度不由本条目证明"
      ]
    },
    {
      "capability_id": "CAP-0002",
      "name": "普通应用上下文独占装配",
      "domain": "应用装配",
      "purpose_summary": "验证普通应用配置并独占构造包含仓库、服务、线程与适配器的普通应用上下文。",
      "implementation_status": "已实现待验证",
      "status_basis": "F0013为main生产路径可达且已有完成的单函数图；源码显示成功结果通过unique_ptr移交独占所有权。",
      "provider_entries": [
        {
          "function_id": "F0013",
          "complete_signature": "海中鱼巣::普通应用装配结果 海中鱼巣::构造普通应用上下文(const 海中鱼巣::普通应用配置& 配置)",
          "file": "海中鱼巣/装配.普通应用.ixx",
          "definition_line": 128,
          "shortest_depth": 3,
          "chart": "流程图/代码流程图/L3/CF-L3-0001_构造普通应用上下文_现状流程图.md",
          "mapping": "流程图/代码流程图/L3/CF-L3-0001_构造普通应用上下文_逐行代码映射表.md"
        }
      ],
      "inputs": [
        "普通应用配置只读引用"
      ],
      "preconditions": [
        "配置通过普通应用配置::有效"
      ],
      "outputs": [
        "配置无效、已装配或构造失败状态",
        "成功时返回独占拥有的普通应用上下文"
      ],
      "state_reads": [
        "普通应用配置"
      ],
      "state_writes": [],
      "side_effects": [
        "分配并构造普通应用上下文及其成员"
      ],
      "transaction_contract": "装配本身不执行系统初始化或业务事务；成员构造的具体副作用需按成员图继续核对。",
      "logic_results": [
        "配置无效",
        "已装配"
      ],
      "internal_error_boundaries": [
        "有效配置后的分配或成员构造异常返回构造失败"
      ],
      "evidence": [
        {
          "kind": "源码",
          "path": "海中鱼巣/装配.普通应用.ixx",
          "locator": "128-137",
          "status": "冻结提交存在"
        },
        {
          "kind": "现状流程图",
          "path": "流程图/代码流程图/L3/CF-L3-0001_构造普通应用上下文_现状流程图.md",
          "locator": "F0013",
          "status": "已完成静态制图"
        },
        {
          "kind": "正式规范",
          "path": "规范/8120_子规范_程序入口启动模式与运行宿主边界_20260726.md",
          "locator": "第5节",
          "status": "装配边界依据"
        }
      ],
      "reuse_boundary": "只适合作为普通程序当前依赖集合的装配入口；装配成功不得替代系统初始化或生产运行期上下文发布。",
      "known_gaps": [
        "本轮未构建或运行成员构造失败注入",
        "上下文成员的逐项能力不由本条目单独证明"
      ]
    },
    {
      "capability_id": "CAP-0003",
      "name": "普通系统分阶段初始化",
      "domain": "系统初始化",
      "purpose_summary": "按固定阶段初始化方法登记根、自我线程、概念图四根和自我存在根支持，并返回结构化阶段结果。",
      "implementation_status": "已实现待验证",
      "status_basis": "F0015为普通与数据库模式可达，已有完整单函数图和阶段短路证据；本轮未运行入口初始化专项。",
      "provider_entries": [
        {
          "function_id": "F0015",
          "complete_signature": "海中鱼巣::系统初始化结果 海中鱼巣::初始化普通系统(const 海中鱼巣::系统初始化端口& 端口, const 海中鱼巣::系统初始化请求& 请求)",
          "file": "海中鱼巣/领域/初始化.系统.ixx",
          "definition_line": 75,
          "shortest_depth": 3,
          "chart": "流程图/代码流程图/L3/CF-L3-0003_初始化普通系统_现状流程图.md",
          "mapping": "流程图/代码流程图/L3/CF-L3-0003_初始化普通系统_逐行代码映射表.md"
        }
      ],
      "inputs": [
        "六回调系统初始化端口",
        "系统初始化请求"
      ],
      "preconditions": [
        "初始化请求有效",
        "初始化端口完整"
      ],
      "outputs": [
        "方法登记根材料",
        "自我线程启动与初始化快照",
        "概念图初始化结果",
        "自我存在根支持",
        "逐阶段系统初始化状态"
      ],
      "state_reads": [
        "自我线程初始化快照",
        "概念图根结构读回"
      ],
      "state_writes": [
        "经端口调用的领域初始化函数可以形成对应结构"
      ],
      "side_effects": [
        "启动自我线程",
        "初始化方法和概念结构"
      ],
      "transaction_contract": "F0015自身是分阶段编排，不把各阶段纳入一个统一回滚事务；各被调能力的事务边界必须独立核对。",
      "logic_results": [
        "请求无效",
        "端口无效",
        "方法登记根失败",
        "自我线程启动或初始化失败",
        "概念图初始化失败",
        "存在根支持失败",
        "已初始化"
      ],
      "internal_error_boundaries": [
        "生产语境下前置通过后的阶段失败需要追根因",
        "自检替身语境中的具名失败注入不等于生产逻辑错误"
      ],
      "evidence": [
        {
          "kind": "源码",
          "path": "海中鱼巣/领域/初始化.系统.ixx",
          "locator": "75-121",
          "status": "冻结提交存在"
        },
        {
          "kind": "现状流程图",
          "path": "流程图/代码流程图/L3/CF-L3-0003_初始化普通系统_现状流程图.md",
          "locator": "F0015",
          "status": "已完成静态制图"
        },
        {
          "kind": "正式规范",
          "path": "规范/8120_子规范_程序入口启动模式与运行宿主边界_20260726.md",
          "locator": "第5-6节",
          "status": "初始化顺序与专项边界依据"
        },
        {
          "kind": "自检入口",
          "path": "海中鱼巣/自检.入口初始化.ixx",
          "locator": "F0029 登记入口初始化自检单元",
          "status": "入口存在；本轮未运行"
        }
      ],
      "reuse_boundary": "只能复用为普通系统完整初始化编排；需要其中某一阶段时应直接比较对应提供者合同，不能调用整条初始化链取得局部副作用。",
      "known_gaps": [
        "各阶段不处于一个统一撤销事务",
        "本轮没有运行14项入口初始化自检"
      ]
    },
    {
      "capability_id": "CAP-0004",
      "name": "数据库启动结构审计往返",
      "domain": "数据库审计投影",
      "purpose_summary": "形成非权威结构统计快照，写入SQL审计投影，再读回一条记录核对编号和三类结构数量。",
      "implementation_status": "已实现待验证",
      "status_basis": "F0018为普通和数据库专项路径可达，源码及现状图明确四个端口调用与往返核对；本轮未运行SQL专项。",
      "provider_entries": [
        {
          "function_id": "F0018",
          "complete_signature": "海中鱼巣::数据库启动审计结果 海中鱼巣::执行启动结构审计(const 海中鱼巣::数据库启动审计端口& 端口, 海中鱼巣::数据库审计要求 要求)",
          "file": "海中鱼巣/适配/审计.数据库启动.ixx",
          "definition_line": 55,
          "shortest_depth": 3,
          "chart": "流程图/代码流程图/L3/CF-L3-0006_执行启动结构审计_现状流程图.md",
          "mapping": "流程图/代码流程图/L3/CF-L3-0006_执行启动结构审计_逐行代码映射表.md"
        }
      ],
      "inputs": [
        "数据库启动审计端口",
        "数据库审计要求"
      ],
      "preconditions": [
        "端口完整",
        "缓存命名空间满足源码中的类型、来源、版本和值类型检查"
      ],
      "outputs": [
        "数据库启动审计结果",
        "命名空间、结构统计快照、写入和读回材料"
      ],
      "state_reads": [
        "权威结构统计快照",
        "最近一条SQL审计投影"
      ],
      "state_writes": [
        "SQL非权威结构统计审计记录"
      ],
      "side_effects": [
        "经端口执行一次SQL写入和一次读回"
      ],
      "transaction_contract": "SQL审计不参与领域机器事实事务，也不得成为系统初始化成功条件。",
      "logic_results": [
        "端口无效",
        "命名空间失败",
        "写入失败",
        "读回失败",
        "往返一致",
        "字段不一致"
      ],
      "internal_error_boundaries": [
        "数据库审计要求参数当前未被源码读取",
        "命名空间校验未覆盖可持久化与精确失效条件"
      ],
      "evidence": [
        {
          "kind": "源码",